query_id,query,result position,url,article_text1,article_text2
1,it is (more risky|riskier) (coronavirus | covid | pandemic),1,https://www.voanews.com/covid-19-pandemic/how-risky-flying-during-coronavirus-pandemic,"WASHINGTON - How risky is flying during the coronavirus pandemic?



Flying can increase your risk of exposure to infection, but airlines are taking some precautions and you can too.



Air travel means spending time in security lines and airport terminals, which puts you into close contact with other people. As travel slowly recovers, planes are becoming more crowded, which means you will likely sit close to other people, often for hours, which raises your risk.



Once on a plane, most viruses and other germs don't spread easily because of the way air circulates, according to the U.S. Centers for Disease Control and Prevention. Airlines also say they are focusing on sanitizing the hard surfaces that passengers commonly touch.



Some airlines like Alaska, Delta, JetBlue and Southwest are blocking middle seats or limiting capacity. But even if every middle seat is empty you will likely be closer than the recommended distance of 6 feet to another passenger now that planes are getting fuller.



American, United and Spirit are now booking flights to full capacity when they can. All leading U.S. airlines require passengers to wear masks. Lauren Ancel Meyers, an expert in disease outbreaks at the University of Texas, says that can help limit risk.



For air travel, and all other types of transportation, the CDC recommends washing your hands, maintaining social distancing and wearing face coverings.



Several airlines announced Monday that they will ask passengers about possible COVID-19 symptoms and whether they have been in contact with someone who tested positive for the virus in the previous two weeks.



Still, Meyers said you still might consider whether you need to be on that plane. ""We should all be in the mindset of 'only if necessary' and always taking the most precautions we can to protect ourselves and others,"" she said.","        Skip to main content           Open main navigation           Live TV            Full Schedule   All Programs          Live Radio                 Full Schedule   All Programs          United States      US Politics    Immigration    All About America      Science & Health    Silicon Valley & Technology        World      Africa    The Americas    East Asia Pacific    Europe      Extremism Watch    Middle East    South & Central Asia    VOA News on Iran        Sections      Arts & Culture    Day in Photos    Economy & Business    Press Freedom      Plugged in with Greta Van Susteren    VOA StudentU    VOA Connect    Refugees              FEATURED  US News  Press Freedom  VOA News on Iran  COVID-19 Pandemic  Editorials          Search       Search VOA News     Search         Lang     Live TV           Live TV            Full Schedule   All Programs          Live Radio          Live Radio                 Full Schedule   All Programs                  English   English  voanews.com    Learning English  learningenglish.voanews.com     Eastern & Central Europe   Shqip  zeriamerikes.com    Bosanski  ba.voanews.com    Ελληνικά  gr.voanews.com    Македонски  mk.voanews.com    Srpski  glasamerike.net    Українська  ukrainian.voanews.com     Eurasia   Հայերեն  amerikayidzayn.com    Azerbaijani  amerikaninsesi.org    ქართული  amerikiskhma.com    Русский  golos-ameriki.ru     Central Asia   O‘zbek‎  amerikaovozi.com     South Asia   বাংলা  voabangla.com    دری  darivoa.com    پښتو  pashtovoa.com    وی او اې ډيوه ريډیو  voadeewanews.com    ارد  urduvoa.com     East & Southeast Asia   ျမန္မာ  burmese.voanews.com    粤语  voacantonese.com    中文  voachinese.com    Bahasa Indonesia  voaindonesia.com    ខ្មែរ  khmer.voanews.com    Khmer  voacambodia.com    한국어  voakorea.com    ລາວ  lao.voanews.com    ไทย  voathai.com    བོད་ཡིག  voatibetan.com    Tiếng Việt  voatiengviet.com     Africa   Afaan Oromoo  voaafaanoromoo.com    አማርኛ  amharic.voanews.com    Bambara  voabambara.com    Français  voaafrique.com    Hausa  voahausa.com    Kinyarwanda / Kirundi  radiyoyacuvoa.com    Ndebele  voandebele.com    Português  voaportugues.com    Shona  voashona.com    Soomaaliga  voasomali.com    Kiswahili  voaswahili.com    ትግርኛ  tigrigna.voanews.com    Zimbabwe  voazimbabwe.com     Middle East/North Africa   فارسی  ir.voanews.com    كوردی  dengiamerika.com    Kurdi  dengeamerika.com    Türkçe  amerikaninsesi.com     Latin America   Creole  voanouvel.com    Español  voanoticias.com                Share on Facebook    Share on Twitter    Share via Email    Print this page       COVID-19 Pandemic  How Risky Is Flying During Coronavirus Pandemic?     By  Associated Press   June 30, 2020 08:45 AM         Share on Facebook    Share on Twitter    Share via Email    Print this page               Illustration by Peter Hamlin.         WASHINGTON  - How risky is flying during the coronavirus pandemic? Flying can increase your risk of exposure to infection, but airlines are taking some precautions and you can too. Air travel means spending time in security lines and airport terminals, which puts you into close contact with other people. As travel slowly recovers, planes are becoming more crowded, which means you will likely sit close to other people, often for hours, which raises your risk. Once on a plane, most viruses and other germs don't spread easily because of the way air circulates, according to the U.S. Centers for Disease Control and Prevention. Airlines also say they are focusing on sanitizing the hard surfaces that passengers commonly touch. Some airlines like Alaska, Delta, JetBlue and Southwest are blocking middle seats or limiting capacity. But even if every middle seat is empty you will likely be closer than the recommended distance of 6 feet to another passenger now that planes are getting fuller. American, United and Spirit are now booking flights to full capacity  when they can. All leading U.S. airlines require passengers to wear masks. Lauren Ancel Meyers, an expert in disease outbreaks at the University of Texas, says that can help limit risk. For air travel, and all other types of transportation, the CDC recommends washing your hands, maintaining social distancing and wearing face coverings. Several airlines announced Monday that they will ask passengers about possible COVID-19 symptoms and whether they have been in contact with someone who tested positive for the virus in the previous two weeks. Still, Meyers said you still might consider whether you need to be on that plane. ""We should all be in the mindset of 'only if necessary' and always taking the most precautions we can to protect ourselves and others,"" she said.       Related Stories                      COVID-19 Pandemic    Why Are Some Planes Crowded Even with Air Travel Down?    The carriers say they are taking action to ease passengers' fears about coronavirus contagion.           By Associated Press   Wed, 05/06/2020 - 14:25                          Economy & Business    American Airlines Warns Flights May Be More Crowded in July    American said it will notify customers if their flight is going to be full and allow them to move to more open flights when available           By Reuters   Fri, 06/26/2020 - 12:28                          COVID-19 Pandemic    White House Does Not Commit to Temperature Checks in Meeting with U.S. Airlines    Airlines want government to administer temperature checks to all passengers in bid to reassure public           By Reuters   Sat, 06/27/2020 - 01:39                          Economy & Business    United Airlines Places Stricter Consequences on Face Covering Policy    Passengers non-compliant with United’s face mask policy can be placed on 'internal restriction list'           By VOA News   Tue, 06/16/2020 - 14:14                 By   Associated Press               COVID-19 Pandemic    Luck, Culture Helped Cambodia Contain Coronavirus                          South & Central Asia    COVID-19 Adds to Addiction Woes in Afghanistan                          USA    On Trump Trip to Mt. Rushmore, Masks & Social Distancing Not Required                          US Politics    Capitol Hill Tries to End COVID-19 Mask Fight                            COVID-19 Pandemic    WHO Urges African Countries Resuming Air Travel to Take Safety Measures                           Special Section         How the Pandemic is Reshaping State Power                                                                         Twitter  Instagram  Facebook  YouTube  RSS    Search VOA News     Search       United States      US Politics    Immigration      All About America    Silicon Valley and Technology        World News      Africa    The Americas    East Asia Pacific      Europe    Middle East    South & Central Asia        Sections      Arts & Culture    Day in Photos    Economy & Business    Extremism Watch    Press Freedom      Science & Health    VOA StudentU    VOA Connect    Refugees        Voice of America      About VOA    Contact VOA    Terms of Use and Privacy Notice    Accessibility    Get Our Mobile App    Usage Requests      VOA Around the World    VOA Pronunciation Guide    Media Relations    Listen on the radio    Satellite Schedule    Subscribe to Our Newsletters                "
