query_id,query,result position,url,article_text1,article_text2
1,it is (more risky|riskier) (coronavirus | covid | pandemic),4,https://www.bbc.com/news/health-52849691,"Image copyright Getty Images Image caption People sunbathing on the beach by Bournemouth pier as lockdown eases

Relaxing lockdown is a risk because levels of the coronavirus are still ""very high"", one of the government's top science advisers says.

Prof John Edmunds said it was a ""political decision"" to lift lockdown and that ""many"" scientists would wait.

The warning comes as Sage, the group of scientists advising government, publish details of their confidential meetings.

One meeting on 23 April estimated there would be only 1,000 cases per day by mid-May.

Instead, estimates by the Office for National Statistics suggest there are currently 8,000 cases per day in England alone. Those figures don't include cases in care homes or hospitals.

'Little time for stringent measures'

""Many of us would prefer to see the incidence down to lower levels before we relax measures,"" Prof Edmunds, from the London School of Tropical Hygiene and Medicine, said.

Sir Jeremy Farrar, director of the Wellcome Trust and a member of Sage, agreed that measures were being lifted too early, writing on Twitter that the newly-introduced NHS test and trace system needed to be ""fully working"" before measures were eased.

Newly-published Sage documents also warned of the dangers of having high numbers of cases.

They say this would ""give little time to re-impose more stringent measures"" if the infection rate (the R-number) started to increase.

Disease modellers feeding into Sage discussions said having high levels of the virus could allow restrictions to be eased as more people would develop immunity to the virus.

But that would ""result in tens of thousands of direct deaths"" and could not be achieved by autumn without intensive care units being overwhelmed.

Media playback is unsupported on your device Media caption Prof John Edmunds said it was a ""political decision"" to lift lockdown and ""many"" scientists would wait

The minutes of 34 Sage sessions, going back to 22 January, have been released alongside a series of scientific reports.

Normally the details of the meetings - which include chief science adviser Sir Patrick Vallance and chief medical adviser Prof Chris Whitty - remain secret until after an emergency is over.

However, the unprecedented nature of the coronavirus pandemic has led to demands for more openness and the creation of alternative scientific bodies such as ""Independent Sage"".

The documents also show that only half of people are isolating for seven days when they become sick.

This comes as testing and contact tracing will require anyone who comes into close contact with an infected person to isolate for 14 days, even if they do not become sick.

Image copyright Getty Images Image caption Sir Patrick Vallance heads up Sage, the body which provides scientific advice to government

Behavioural scientists advising government ""strongly recommend"" monitoring how well people were keeping to the rules.

Sage documents showed keeping the R number below one (the point at which the epidemic starts to grow again) would require 80% of contacts to be found within 48 hours.

The scientists agreed that social distancing would need to be maintained even if test and trace was effective.

'Taking a risk'

However, the government's testing tsar said it would be ""very difficult"" to get the results of home tests in less than 48 hours, never mind find their contacts. Tests at drive-through centres are faster.

Prof Edmunds said: ""With untested 'test and trace' we are taking some risk here.""

And he warned that even if test and trace was successful, easing restrictions would keep cases at 8,000 a day and lead to around 80 deaths a day.

Contact tracing starts when somebody tests positive. There is disagreement between Sage scientists with some arguing it should start when symptoms are reported, to increase the speed of the process. Others argue ""false alarms"" could discourage people from complying with the instruction to isolate.

The documents also showed:

On March 13, just before the government changed strategy, ""Sage was unanimous that measures seeking to completely suppress spread of Covid-19 will cause a second peak""

The advice said neighbourhood or local lockdowns could undermine national measures or lead to a significant issue of disorder.

Even if every adult with a smartphone had the contact tracing app, it would not identify more than 50% of contacts

In mid-Feb, Sage said a ""lack of data from China continues to hamper understanding""

The PM's top adviser Dominic Cummings attended six out of the 34 meetings

Hairdressers and other ""personal care services"" should not reopen soon as they ""typically rely on highly-connected workers who may accelerate transmission""

The risk from attending large events is no higher than small ones because ""close contact"" is the biggest risk

Family gatherings are ""particularly high risk"" and religious services with high levels of physical contact are ""higher risk""

Since April 23, Sage has called for routine testing of all healthcare staff and on 7 May said this should take place even when there are no symptoms

Modellers disagree on the impact of moving into ""phase 2"" including some children going to school, with some worried it will bring the R number above 1

Sir Patrick said: ""During one of the most serious pandemics in our recorded history, people are understandably concerned and worried about what the future holds and are looking to the science for answers.

""Openness and transparency around this disease is a social imperative, which is why it's important we don't wait to publish minutes and evidence.""

Follow James and Rachel on Twitter.","        Homepage Accessibility links Skip to content Accessibility Help  BBC Account Notifications  Home News Sport Weather iPlayer Sounds CBBC CBeebies Food Bitesize Arts Taster Local Three Menu Search Search the BBC Search the BBC             News   BBC News Navigation     Sections           Home      Video      World      UK      Business      Tech      Science      Stories      Entertainment & Arts      Health   selected     World News TV      In Pictures      Reality Check      Newsbeat      Special Reports      Explainers      The Reporters      Have Your Say                Health               Health              Coronavirus: Relaxing lockdown 'risky' and a 'political decision'   By James Gallagher & Rachel Schraer  BBC News        30 May 2020  comments              Share this with Facebook           Share this with Messenger           Share this with Twitter           Share this with Email           Share this with Facebook           Share this with WhatsApp           Share this with Messenger           Share this with Twitter      Share    Share this with  These are external links and will open in a new window      Email  Share this with Email       Facebook  Share this with Facebook       Messenger  Share this with Messenger       Messenger  Share this with Messenger       Twitter  Share this with Twitter       Pinterest  Share this with Pinterest       WhatsApp  Share this with WhatsApp       LinkedIn  Share this with LinkedIn     Copy this link   https://www.bbc.com/news/health-52849691   Read more about sharing.  These are external links and will open in a new window   Close share panel          Related Topics Coronavirus pandemic        Image copyright  Getty Images    Image caption  People sunbathing on the beach by Bournemouth pier as lockdown eases   Relaxing lockdown is a risk because levels of the coronavirus are still ""very high"", one of the government's top science advisers says. Prof John Edmunds said it was a ""political decision"" to lift lockdown and that ""many"" scientists would wait. The warning comes as Sage, the group of scientists advising government, publish details of their confidential meetings. One meeting on 23 April estimated there would be only 1,000 cases per day by mid-May. Instead, estimates by the Office for National Statistics suggest there are currently 8,000 cases per day in England alone. Those figures don't include cases in care homes or hospitals.     'Little time for stringent measures' ""Many of us would prefer to see the incidence down to lower levels before we relax measures,"" Prof Edmunds, from the London School of Tropical Hygiene and Medicine, said. Sir Jeremy Farrar, director of the Wellcome Trust and a member of Sage, agreed that measures were being lifted too early, writing on Twitter that the newly-introduced NHS test and trace system needed to be ""fully working"" before measures were eased. Newly-published Sage documents also warned of the dangers of having high numbers of cases. They say this would ""give little time to re-impose more stringent measures"" if the infection rate (the R-number) started to increase. Disease modellers feeding into Sage discussions said having high levels of the virus could allow restrictions to be eased as more people would develop immunity to the virus. But that would ""result in tens of thousands of direct deaths"" and could not be achieved by autumn without intensive care units being overwhelmed.      A SIMPLE GUIDE: How do I protect myself?   IMPACT: What the virus does to the body   RECOVERY: How long does it take?   LOCKDOWN: How can we lift restrictions?   ENDGAME: How do we get out of this mess?          Media playback is unsupported on your device        Media caption Prof John Edmunds said it was a ""political decision"" to lift lockdown and ""many"" scientists would wait  The minutes of 34 Sage sessions, going back to 22 January, have been released alongside a series of scientific reports. Normally the details of the meetings - which include chief science adviser Sir Patrick Vallance and chief medical adviser Prof Chris Whitty - remain secret until after an emergency is over. However, the unprecedented nature of the coronavirus pandemic has led to demands for more openness and the creation of alternative scientific bodies such as ""Independent Sage"". The documents also show that only half of people are isolating for seven days when they become sick. This comes as testing and contact tracing will require anyone who comes into close contact with an infected person to isolate for 14 days, even if they do not become sick.    Image copyright  Getty Images    Image caption  Sir Patrick Vallance heads up Sage, the body which provides scientific advice to government   Behavioural scientists advising government ""strongly recommend"" monitoring how well people were keeping to the rules. Sage documents showed keeping the R number below one (the point at which the epidemic starts to grow again) would require 80% of contacts to be found within 48 hours. The scientists agreed that social distancing would need to be maintained even if test and trace was effective. 'Taking a risk' However, the government's testing tsar said it would be ""very difficult"" to get the results of home tests in less than 48 hours, never mind find their contacts. Tests at drive-through centres are faster. Prof Edmunds said: ""With untested 'test and trace' we are taking some risk here."" And he warned that even if test and trace was successful, easing restrictions would keep cases at 8,000 a day and lead to around 80 deaths a day. Contact tracing starts when somebody tests positive. There is disagreement between Sage scientists with some arguing it should start when symptoms are reported, to increase the speed of the process. Others argue ""false alarms"" could discourage people from complying with the instruction to isolate. The documents also showed:  On March 13, just before the government changed strategy, ""Sage was unanimous that measures seeking to completely suppress spread of Covid-19 will cause a second peak""  The advice said neighbourhood or local lockdowns could undermine national measures or lead to a significant issue of disorder.  Even if every adult with a smartphone had the contact tracing app, it would not identify more than 50% of contacts  In mid-Feb, Sage said a ""lack of data from China continues to hamper understanding""  The PM's top adviser Dominic Cummings attended six out of the 34 meetings  Hairdressers and other ""personal care services"" should not reopen soon as they ""typically rely on highly-connected workers who may accelerate transmission""  The risk from attending large events is no higher than small ones because ""close contact"" is the biggest risk  Family gatherings are ""particularly high risk"" and religious services with high levels of physical contact are ""higher risk""  Since April 23, Sage has called for routine testing of all healthcare staff and on 7 May said this should take place even when there are no symptoms  Modellers disagree on the impact of moving into ""phase 2"" including some children going to school, with some worried it will bring the R number above 1  Sir Patrick said: ""During one of the most serious pandemics in our recorded history, people are understandably concerned and worried about what the future holds and are looking to the science for answers. ""Openness and transparency around this disease is a social imperative, which is why it's important we don't wait to publish minutes and evidence."" Follow James and Rachel on Twitter.      View comments    Related Topics Coronavirus lockdown measures Schools Coronavirus pandemic Social distancing    Share this story About sharing      Email      Facebook      Messenger      Messenger      Twitter      Pinterest      WhatsApp      LinkedIn                                 Top Stories   England to halt quarantine for dozens of nations  People arriving in England from dozens of nations will no longer need to quarantine from 10 July.  3 July 2020    China appoints hard-line Hong Kong security chief  3 July 2020    Khashoggi murder trial begins in Turkey  3 July 2020          Features           Why this 4 July will be unlike any other            Outrage as judge calls alleged rape victim 'unbecoming'            Video      Protest, rally or eating out - Where is riskier?                 Finding the 'invisible' millions who are not on maps            Deciding who lives and dies in a Cape Town township            Sky is the limit for Pakistan's metal artist            TikTok's Boogaloo extremism problem            Weekly quiz: Which city had a coronavirus 'farewell' bash?            Africa's top shots: Starting blocks and independence heroes            Elsewhere on the BBC             Lyrics quiz    Have you been getting these songs wrong?   Full article Lyrics quiz             Feeling hot    What happens to your body in extreme heat?   Full article Feeling hot                                  Why you can trust BBC News       BBC News Navigation   Sections     Home      Video      World      World Home   Africa    Asia    Australia    Europe    Latin America    Middle East    US & Canada         UK      UK Home   England    N. Ireland    Scotland    Wales    Politics         Business      Business Home   Market Data    Global Trade    Companies    Entrepreneurship    Technology of Business    Connected World    Global Education    Economy         Tech      Science      Stories      Entertainment & Arts      Health   selected     World News TV      In Pictures      Reality Check      Newsbeat      Special Reports      Explainers      The Reporters      Have Your Say          BBC News Services    On your mobile    On smart speakers    Get news alerts    Contact BBC News         Explore the BBC Home News Sport Weather iPlayer Sounds CBBC CBeebies Food Bitesize Arts Taster Local Three  Terms of Use About the BBC Privacy Policy Cookies Accessibility Help Parental Guidance Contact the BBC Get Personalised Newsletters Copyright © 2020 BBC. The BBC is not responsible for the content of external sites. Read about our approach to external linking."
