query_id,query,result position,url,article_text1,article_text2
As of 20 March 2020 , the number of SARS-CoV-2 tests per capita in Poland was lower than that of 22 other members of the European Union, the EFTA and the European Economic Area, and above that of Croatia and Hungary.[75] Among 19 mostly European countries analysed by OKO.press using data from 20 March, the number of tests per positive detection was 30.8 tests per positive detection in Poland, higher than for any of the other European countries listed, including Germany (28.7) and Norway (28.1), and lower than in South Korea at 36.6 and Russia at 721 tests per positive detection.[76]

Medical supplies [ edit ]

On 26 March, the Minister of Health Łukasz Szumowski claimed that European solidarity in the provision of medical equipment to Poland had failed. OKO.press qualified the claim as ""false"" and accused the minister of deliberately misleading public opinion.[16] OKO.press referred to the European Union (EU) tender process for masks and other protective equipment as a ""success"" that Poland applied for very late, and commented as context that the EU does not have the legal powers to impose health management policy, such as quarantine measures or closing schools, on member states. The EU tender process was announced on 28 February 2020, to which 20 member states, without Poland, responded. Poland joined the mechanism on 6 March, qualifying for a procedure opened on 17 March for the purchase of gloves, goggles, face protectors, surgical masks and clothing. The European Commission claimed that all the purchases were satisfied by offers, and should arrive within two weeks. Commissioner Thierry Breton described the procedure as illustrating the power of EU coordination.[16] On 19 March, the EU announced the creation of the rescEU strategic stockpile of medical equipment, to be financed at the level of 90% by the Commission, to deal with the COVID-19 pandemic.[77]

Impact [ edit ]

Economy [ edit ]

The pandemic and the isolation measures in response to it had a serious influence on the Polish economy, especially commerce, tourism and the hospitality industries.[78]

Anti-crisis Shield [ edit ]

The government prepared a plan of public assistance to businesses, called the ""Anti-crisis Shield"" (Polish: Tarcza antykryzysowa). The program was launched on 1 April 2020.[78] The program consists primarily of the following five areas.[79]

Financial safety of employees and protection of jobs

Government-paid social insurance contributions for three months, for companies employing up to nine people, self-employed individuals and freelancers.

One-off benefits of circa 2,000 PLN gross (80% of the monthly minimal wage) for self-employed and freelancers. Around 2.2 million people are estimated to be eligible for these benefits.

Working permits for non-citizens are to be prolonged to 30 days after the official revoking of the state of epidemic (as of early April 2020, a formal state of emergency or state of natural disaster had not been declared), if they expire during the state of epidemic.[80]

Finance of business

Business finance measures include:[81]

Public co-financing of employees' salaries up to 40% of the average monthly wage, if working time has been reduced up to 20%, but no less than working time for a part-time position.

The taxpayers affected by pandemic are entitled to deduct their losses incurred in 2020 from income obtained in 2019 providing that revenue has diminished by more than 50%.

Non-repayable loans up to 5,000 PLN for companies employing up to 9 people, but there cannot be any lay-offs within the next 6 months. [82]

Enabling legally the company credit-worthiness assessing on the basis of former year financial statement in order to extend the repayment terms of business overdrafts.

Postponing the deadlines of withholding taxes, submitting the fiscal declarations and implementation of mandatory Employee Pension Plan (EPP, pol. Pracownicze Plany Kapitałowe, PPK)

Healthcare

Enabling the taxpayers to deduct their donations given for counteracting the pandemic from their income.

Enhancing financial market soundness

Reducing banks' capital buffers requirements by Financial Stability Committee.[83]

Public investment plan

Elongated deadlines of public projects and cancellation of deadlines penalties in public tenders.

The public purchases for equipment needed in counteracting the pandemic no longer has to conform the public procurement law.

Solidarity with other countries [ edit ]

Polish authorities and citizens took several solidarity actions to support people in other countries affected by the pandemic and to help in repatriations.[84][85][86]

The Polish government sent medical supplies to Italy and San Marino, including 20,000 litres of disinfectants to Veneto and San Marino, produced by the state-owned Polfa Tarchomin, and a load of medical supplies on 7 April 2020.[84] The Polish Centre for International Aid sent a team of 15 Polish doctors and paramedics to a field hospital in Brescia, Lombardy.[87] Doctors from WIM Warszawa share their Italian COVID-19 experience with Armenian, Azeri and Moldovan colleagues. Polish farmers allocated some of their production to Italian doctors, nurses and other healthcare professionals.[88] The Italian flag was shown as an illumination on many buildings in Poland.[89][90] Polish authorities sent Spain 20,000 litres of Trisept Complex disinfectant liquid.[91]

A medical mission from Warsaw's Military Institute of Medicine went to Chicago on 23 April 2020 to help in COVID-19 management.[92][93] On 13 April 2020, the Representation of Solidarity Fund PL in Georgia provided spraying equipment, 500 visors and 800 reusable face masks to municipal authorities in Rustavi and Marneuli (Lower Kartli), Gori (Inner Kartli) and to a clinic in Nikozi, near the demarcation line with South Ossetia.[94] The Polish Ministry of Foreign Affairs allocated 1.2 million PLN to projects aimed at supporting emergency services in Georgia and Ukraine.[95] A convoy of the Polish State Fire Service carrying humanitarian cargo for the National Medical Response Center arrived in Minsk in Belarus on 24 April, for medical institutions in Grodno Oblast, including 50,000 litres of disinfectant, 30,000 litres of antiseptic, 100,000 surgical masks and chloroquine.[96]

The Polish company Wipasz donated 100,000 reusable protective masks to Kazakhstan, laptops for Kazakhstani schoolchildren.[97][98] A team of Polish eight doctors, nurses and paramedics from Polish Center of International Aid participated in the World Health Organization support program, spending a ten-day mission training staff in Kyrgyz hospitals.[99]

The Polish community participated in grassroots solidarity actions around the world. Volunteers of the Polish Catholic Mission in Freiburg, Breisgau, organized help and emergency counselling,[100] teachers from Polish schools in the Czech Republic sewed masks and provided them to senior peoples' homes,[86] the Polish community in Canada printed 3D protective materials and helped in shopping, the Polish Medical Association from Berdyansk in Ukraine organized telephone consultations, the Association of Poles in Spain nasz Dom – Nuetra casa provided legal and psychological support and sewed protective clothing for nursing homes.[101]

The Polish airline LOT used Twitter to organise a ""#LOTdoDomu"" (""#aFLIGHTHome"") return program of 2,000 people to their countries of origin, including 18 other member states of the European Union (EU).[85] The programme was completed on 5 April 2020. LOT also organised 388 special charter flights over 22 days which brought 55,000 Polish citizens and workers to Poland. Polish authorities offered ferry and dedicated train services, and 18 convoys of 800 vehicles, escorted by police, to help Estonians, Latvians and Lithuanians to return to their countries.[102]

Censorship of medical personnel [ edit ]

On 18 March 2020, an experienced midwife in a Lesser Poland Voivodeship hospital published a report on Facebook on the conditions of medical personnel and the situation of the hospital in relation to the COVID-19 pandemic. On 19 March, she was fired from the hospital[103] by Marek Wierzba. He stated that medical staff should be responsible, reliable and should publish true information. He also stated that the dismissed midwife had been spreading panic. Polish Minister of Health Łukasz Szumowski stated that she shouldn't have been fired.[104]

On 20 March, the secretary of state of the Ministry of Health, Józefa Szczurek-Żelazko [pl], sent a written statement ordering voivodeship medical consultants to not make statements about SARS-CoV-2, the epidemiological situation, the risks for medical staff or methods of protection from infection, unless they had first consulted with the Ministry of Health or Główny Inspektorat Sanitarny [pl]. Szczurek-Żelazko motivated the order by the need to provide correct, unified information and to avoid unjustified unrest in the medical community.[105]

A surgeons group, Porozumienie Chirurgów SKALPEL, described the order as blackmail and said that it risked catastrophe. The group stated that the COVID-19 pandemic showed Poland as ""not at all prepared for crisis situations"" with a ""lack of equipment, basic personal protective gear and disinfectant materials and a lack of standards and procedures"".[21]

On 25 March 2020, the Polish Ombudsman Adam Bodnar sent a letter to the Minister of Health, Szumowski, stating that medical staff's freedom of speech and is guaranteed under Articles 2 and 54 of the Polish Constitution and the right of the public to information is guaranteed under Article 61 of the constitution. Bodnar stated that firing or punishing doctors for informing the public during the pandemic could be a violation of the ""obligatory standards"". Bodnar asked if Szumowski was aware of the situation and requested a clarification of policy.[103]

Spread of SARS-CoV-2 within and around Poland [ edit ]

SARS-CoV-2 spread in Poland and its neighbours: cumulative DE CZ SK BY Cumulative number of SARS-CoV-2 lab-confirmed cases in Poland compared with that of Poland's seven terrestrial neighbours. Poland: red; EU LT ): shades of green; non-EU ( RU UA ): shades of blue.

SARS-CoV-2 spread in Poland and its neighbours: daily Daily spread of SARS-CoV-2 in Poland compared with that of Poland's seven terrestrial neighbours. Poland: red; EU : shades of green; non-EU: shades of blue. Values of zero are shown as ""1"".

After the first laboratory confirmed SARS-CoV-2 case in Poland on 4 March 2020, in Lubusz Voivodeship, bordering Germany,[3] cases were confirmed in seven other voivodeships throughout Poland during 5–9 March 2020,[106] covering eight of the sixteen voivodeships. On 17 March, all sixteen voivodeships had recorded SARS-CoV-2 positive cases, with the final two voivodeships being Kujawsko-Pomorskie and Podlaskie.[107][108]

On 15 March, Poland closed its land borders for 10 days, and international airports for 14 days for passenger traffic, only allowing Polish residents, citizens and those with immediate Polish family to enter Poland. People entering Poland were required to be quarantined for 14 days.[33]

Additional information [ edit ]

COVID-19 versus non-COVID-19 death classification [ edit ]

On 26 March 2020, the Polish health authorities' classification of COVID-19 deaths only included deaths of people with lab-confirmed SARS-CoV-2 infection, classified as U07.1 under the ICD-10 international disease classification system.[23] COVID-19 deaths under U07.2, which had been defined by WHO one day earlier[7] to mean deaths when ""COVID-19 is diagnosed clinically or epidemiologically but laboratory testing is inconclusive or not available"",[22] were not yet included in the NIPH–NIH instructions.[7] Stefan Karczmarewicz, writing in Polityka, interpreted this as an attempt by authorities to lower the official COVID-19 death toll in Poland. He argued that there was a policy of limiting the number of SARS-CoV-2 tests, which together with the exclusion of the ICD-10 category U07.2 implied an underestimate of the true COVID-19 death toll.[109][110] NIPH–NIH stated that the omission was unintentional due to the timing, and updated its instructions on 1 April, instructing doctors to also use the U07.2 definition of clinically or epidemiologically classified COVID-19 cases.[7] NIPH–NIH stated that the WHO considered it ""irrelevant"" to distinguish between U07.1 and U07.2. On 6 April, Bartosz Fiałek, a Polish rheumatologist, claimed that the NIPH–NIH instructions were unclear, and that it appeared that U07.2 was not being used for COVID-19 deaths in hospital in which SARS-CoV-2 tests had not been carried out, nor for people dying of COVID-19 in quarantine.[9]

Suspected COVID-19 deaths in quarantine [ edit ]

On 21 March 2020, a 45-year-old man who was quarantined in Głogów after returning from outside of Poland and who had shown COVID-19 symptoms was found dead by police. As of 26 March 2020, the prosecutor investigating his death had not decided whether or not to carry out a SARS-CoV-2 laboratory test on the corpse.[8] The dead body of a 50-year-old woman who returned from Germany to Konin and felt ill was found by her family on 24 March. Główny Inspektorat Sanitarny [pl] (GIS, the national health agency) refused to test the corpse for SARS-CoV-2. As of 27 March 2020 , GIS had not stated what procedures were in place for post mortem tests.[8] As of 6 April 2020 , it was not known if any laboratories in Poland were qualified to carry out post-mortem SARS-CoV-2 tests.[9]

Unofficial deaths [ edit ]

There were several claims of COVID-19 deaths unreported by the Ministry of Health. In early April, Warsaw City Council stated that there had been 32 COVID-19 deaths in Warsaw, while official statistics only listed eight. The Minister of Health stated that the difference was that deaths were officially allocated according to the official places of residence of the deceased. The mayor of Warsaw, Rafał Trzaskowski, stated that the data were carefully checked, and that 18 of the 32 were registered as officially living in Warsaw, not eight.[111]

OKO.press claimed that two COVID-19 deaths at a Ministry of Interior and Administration hospital in Warsaw, on 19 March 2020 of a man born in 1942 who had returned from Austria[112] and on 24 March of a psychiatric patient, were not announced by the Ministry of Health.[113] On 26 March, the family of the man born in 1942 claimed that his 19 March death had not been announced.[112] On the same day, 26 March, the Ministry of Health announced the death of a 78-year-old man in Warsaw.[114]

Disagreement between local media, the head of the Kuyavian-Pomeranian Voivodeship, and GIS continued for several days in early April in relation to the 4 April death in a Grudziądz hospital of a 64-year-old woman from Grudziądz who was SARS-CoV-2 positive.[115] Gazeta Pomorska [pl] stated that the head of the voivodeship only accepted including the 64-year-old's death in official reports after the newspaper ""intervened"". As of 8 April 2020 , according to Gazeta Pomorska, the Ministry of Health still listed only one COVID-19 death from Grudziądz (that of an 80-year-old), while local branches of the health agency stated zero SARS-CoV-2 infections from Grudziądz in their reports.[116]

