query_id,query,result position,url,article_text1,article_text2
1,1 (coronavirus | covid | pandemic),1,https://en.wikipedia.org/wiki/COVID-19_pandemic_in_Poland,"Ongoing COVID-19 viral pandemic in Poland

An animated map of the confirmed SARS-CoV-2 cases

Per capita map of SARS-CoV-2 cases in Poland

The COVID-19 pandemic in Poland is part of the worldwide pandemic of coronavirus disease 2019 (COVID-19) caused by severe acute respiratory syndrome coronavirus 2 (SARS-CoV-2). In February and March 2020, health authorities in Poland carried out laboratory testing of suspected cases of infection by SARS-CoV-2, one of the seven known human coronaviruses, as well as home quarantining and monitoring.[11][12] The first case of a laboratory confirmed SARS-CoV-2 infection in Poland was that of a man hospitalised in Zielona Góra, with confirmation announced officially on 4 March 2020.[2][3] The local transmission phase of SARS-CoV-2 in Poland was declared to the World Health Organization on 10 March.[13][14] The first death from coronavirus disease 2019 (COVID-19) in Poland was that of a 56-year-old woman on 12 March.[15] Polish authorities did not participate in the 28 February 2020 European Union tender procedure for purchasing COVID-19 pandemic related medical equipment, in which 20 other member states participated. Poland applied on 6 March for the 17 March tender for the purchase of gloves, goggles, face shields, surgical masks and protective clothing; the European Commission stated that all requests in the tender were satisfied by offers.[16]

As of 25 June 2020 , there were 33,119 laboratory confirmed SARS-CoV-2 cases,[4] 1,412 deaths,[6] and 18,654 recoveries.[5]

Lockdown-type control measures started on 10–12 March, closing schools and university classes and cancelling mass events,[17][18][19] and were strengthened on 25 March, limiting non-family gatherings to two people and religious gatherings to six and forbidding non-essential travel.[20] On 20 March, the Ministry of Health tried to prevent medical personnel from commenting on the pandemic. The Polish Ombudsman Adam Bodnar defended medical personnel's right to speak publicly about the epidemic on constitutional grounds of freedom of speech and the right of the public to information. Doctors opposed the self-censorship orders.[21] Fatality counts initially only included deaths from lab-confirmed SARS-CoV-2 infection (U07.1[22]).[23] Starting on 1 April 2020, fatalities that were clinically or epidemiologically diagnosed as COVID-19 (U07.2)[22]) were also considered as COVID-19 deaths by NIPH–NIH.[7] As of 28 March 2020 , people in Poland who died in quarantine from suspected COVID-19 were not tested post mortem for SARS-CoV-2.[8] As of 29 March 2020 , there were 269,307 people under quarantine for suspected SARS-CoV-2 infection and 42,783 SARS-CoV-2 tests had been made since the beginning of testing.[24] The lockdown restrictions were tightened starting on 31 March–1 April by a government regulation, requiring individuals walking in streets to be separated by two metres, closing parks, boulevards, beaches, hairdressers and beauty salons, and forbidding unaccompanied minors from exiting their homes.[25] A followup regulation on 10 April loosened the restrictions on public gatherings starting from 20 April, allowing religious gatherings and funerals to be held for up to a maximum of 50 people.[26]

Background [ edit ]

Predictions of a pandemic were made repeatedly in the early twenty-first century, prior to the 2019–20 COVID-19 pandemic. The World Health Organization (WHO) and the World Bank warned about the risk of pandemics throughout the 2000s and the 2010s, especially after the 2002–2004 SARS outbreak.[27] The WHO coined the term Disease X in 2018, so that preparations for the next, at-the-time unknown, pandemic could be undertaken.[28] In 2005–2006, prior to the 2009 swine flu pandemic, and during the decade following the pandemic, governments in the United States and France prepared stocks of pandemic protective items and then depleted these stocks.[29][30] In late December 2019 and early January 2020, an outbreak of infections from a virus, which was found to be closely related to the SARS virus, rapidly expanded in Wuhan in China, prior to spreading elsewhere around the world, with the first COVID-19 death being officially reported on 11 January 2020 in Wuhan.[31]

Preparations [ edit ]

Medical tents in front of a hospital in Włocławek for examining patients suspected of SARS-CoV-2 infection (March 2020).

During January 2020, Warsaw Chopin Airport carried out special screening measures for passengers arriving from China.[32]

Testing and monitoring [ edit ]

COVID-19 monitoring in Poland [33] ""Suspected"" means hospitalised for suspected SARS-CoV-2 infection. In the absence of updates, data from earlier dates are repeated without change. Early values of lab-tested counts are shown as ""1"" in the absence of data. Quarantine numbers from 17 March include people quarantined after entering Poland following border closures.

As of 29 February 2020 , four-member teams at the National Institute of Public Health – National Institute of Hygiene (NIPH–NIH) together with the Berlin hospital Charité had carried out 307 genetic tests of samples from suspected SARS-CoV-2 carriers, and 28 tests were waiting to be analysed. NIPH–NIH carried out the tests in its Warsaw laboratory and in the Wojewódzki Szpital Zakaźny in Warsaw. Diagnostic laboratories in eight other towns were being prepared for making similar analyses. The Ministry of Health refused to state how many test kits were available in Polish laboratories.[34]

On 4 March, the Minister of Health claimed that nine laboratories were carrying out SARS-CoV-2 testing (NIPH–NIH and Voivodeship Infectious Disease Hospital in Warsaw, and laboratories in Olsztyn, Wrocław, Poznań, Katowice, Rzeszów, Gdańsk and Kielce),[3] while OKO.press claimed that only four laboratories were carrying out the testing.[35] The Minister claimed that ""sanitary–epidemiological stations"" in Lublin, Łódź and Poznań would start SARS-CoV-2 tests the following day.[3] On 6 March, the Minister stated that 13 laboratories were running SARS-CoV-2 tests.[36]

New law: ""specustawa"" [ edit ]

A new law (nicknamed Polish: specustawa,[37] lit. special law) to manage a possible epidemic of COVID-19 or other infectious diseases in Poland via administrative, budgetary and epidemiological measures passed through a first reading by a parliamentary committee and through second and third readings by the Polish lower house of parliament, the Sejm, on 1 and 2 March, with 400 votes out of 418 in favour in the third reading.[38] Konfederacja was the only parliamentary club which voted against the measure.[39] Philosopher and law professor Jerzy Zajadło [pl] praised the discussion of the bill in the Sejm, in that the Speaker allowed members of parliament to discuss the bill under the principles of deliberative democracy, which he judged rare for the parliament dominated by PiS. Zajadło criticised the bill as establishing vague powers with little chance of checks and balances, which he saw as being in the spirit of the approach of the political party in power; he saw the bill as establishing a permanent state of emergency for COVID-19 and all other contagious diseases; he criticised the wide array of changes implied in the law as having consequences difficult to predict; and he judged the law to be unnecessary given that laws covering the situation already existed.[37] Ewa Łętowska [pl], a former judge in the Polish Constitutional Tribunal, also criticised the law as effectively creating a new, 180-day long state of emergency, in addition to the state of emergency rules defined in the Polish Constitution for a maximum of 90 days. She interpreted the law as giving the authorities arbitrary power without control by administrative courts.[40]

Timeline [ edit ]

COVID-19 cases in Poland ( )

Deaths Recoveries Active cases Mar Mar Apr Apr May May Jun Jun Jul Jul Last 15 days Last 15 days Date # of cases # of deaths 2020-03-04 ​ 1 (n.a.) 2020-03-05 ​ 1 (=) 2020-03-06 ​ 5 (+400%) 2020-03-07 ​ 6 (+20%) 2020-03-08 ​ 11 (+83%) 2020-03-09 ​ 17 (+55%) 2020-03-10 ​ 22 (+29%) 2020-03-11 ​ 31 (+41%) 2020-03-12 ​ ​ 51 (+65%) 1 2020-03-13 ​ ​ 68 (+33%) 2 (+100%) 2020-03-14 ​ ​ 104 (+53%) 3 (+50%) 2020-03-15 ​ ​ 125 (+20%) 3 (=) 2020-03-16 ​ ​ 177 (+42%) 4 (+33%) 2020-03-17 ​ ​ ​ 238 (+34%) 5 (+25%) 2020-03-18 ​ ​ ​ 287 (+21%) 5 (=) 2020-03-19 ​ ​ ​ 355 (+24%) 5 (=) 2020-03-20 ​ ​ ​ 425 (+20%) 5 (=) 2020-03-21 ​ ​ ​ 536 (+26%) 5 (=) 2020-03-22 ​ ​ ​ 634 (+18%) 7 (+40%) 2020-03-23 ​ ​ ​ 749 (+18%) 8 (+14%) 2020-03-24 ​ ​ ​ 900 (+20%) 10 (+25%) 2020-03-25 ​ ​ ​ 1,051 (+17%) 13 (+30%) 2020-03-26 ​ ​ ​ 1,221 (+16%) 16 (+23%) 2020-03-27 ​ ​ ​ 1,389 (+14%) 16 (=) 2020-03-28 ​ ​ ​ 1,638 (+18%) 18 (+12%) 2020-03-29 ​ ​ ​ 1,862 (+14%) 22 (+22%) 2020-03-30 ​ ​ ​ 2,055 (+10%) 31 (+41%) 2020-03-31 ​ ​ ​ 2,311 (+12%) 33 (+6.5%) 2020-04-01 ​ ​ ​ 2,554 (+11%) 43 (+30%) 2020-04-02 ​ ​ ​ 2,946 (+15%) 57 (+33%) 2020-04-03 ​ ​ ​ 3,383 (+15%) 71 (+25%) 2020-04-04 ​ ​ ​ 3,627 (+7.2%) 79 (+11%) 2020-04-05 ​ ​ ​ 4,102 (+13%) 94 (+19%) 2020-04-06 ​ ​ ​ 4,413 (+7.6%) 107 (+14%) 2020-04-07 ​ ​ ​ 4,848 (+9.9%) 129 (+21%) 2020-04-08 ​ ​ ​ 5,205 (+7.4%) 158 (+22%) 2020-04-09 ​ ​ ​ 5,575 (+7.1%) 174 (+10%) 2020-04-10 ​ ​ ​ 5,955 (+6.8%) 181 (+4.0%) 2020-04-11 ​ ​ ​ 6,356 (+6.7%) 208 (+15%) 2020-04-12 ​ ​ ​ 6,674 (+5.0%) 232 (+12%) 2020-04-13 ​ ​ ​ 6,934 (+3.9%) 245 (+5.6%) 2020-04-14 ​ ​ ​ 7,202 (+3.9%) 263 (+7.3%) 2020-04-15 ​ ​ ​ 7,582 (+5.3%) 286 (+8.7%) 2020-04-16 ​ ​ ​ 7,918 (+4.4%) 314 (+9.8%) 2020-04-17 ​ ​ ​ 8,375 (+5.8%) 332 (+5.7%) 2020-04-18 ​ ​ ​ 8,709 (+4.3%) 347 (+4.5%) 2020-04-19 ​ ​ ​ 9,234 (+5.5%) 360 (+3.7%) 2020-04-20 ​ ​ ​ 9,540 (+3.3%) 380 (+5.5%) 2020-04-21 ​ ​ ​ 9,803 (+2.7%) 401 (+5.5%) 2020-04-22 ​ ​ ​ 10,106 (+3.2%) 426 (+6.2%) 2020-04-23 ​ ​ ​ 10,448 (+3.6%) 454 (+6.6%) 2020-04-24 ​ ​ ​ 10,829 (+3.6%) 494 (+8.8%) 2020-04-25 ​ ​ ​ 11,210 (+3.5%) 524 (+6.1%) 2020-04-26 ​ ​ ​ 11,554 (+3.1%) 535 (+2.1%) 2020-04-27 ​ ​ ​ 11,839 (+2.5%) 562 (+5.1%) 2020-04-28 ​ ​ ​ 12,155 (+2.6%) 596 (+6.5%) 2020-04-29 ​ ​ ​ 12,577 (+3.5%) 624 (+4.7%) 2020-04-30 ​ ​ ​ 12,877 (+2.4%) 644 (+3.2%) 2020-05-01 ​ ​ ​ 13,105 (+1.8%) 651 (+1.9%) 2020-05-02 ​ ​ ​ 13,375 (+2.1%) 663 (+1.8%) 2020-05-03 ​ ​ ​ 13,693 (+2.4%) 678 (+2.3%) 2020-05-04 ​ ​ ​ 14,006 (+2.3%) 697 (+2.8%) 2020-05-05 ​ ​ ​ 14,412 (+2.9%) 715 (+2.6%) 2020-05-06 ​ ​ ​ 14,723 (+2.2%) 733 (+2.5%) 2020-05-07 ​ ​ ​ 15,026 (+2.2%) 755 (+3.0%) 2020-05-08 ​ ​ ​ 15,363 (+2.3%) 776 (+2.8%) 2020-05-09 ​ ​ ​ 15,651 (+1.9%) 785 (+1.2%) 2020-05-10 ​ ​ ​ 15,996 (+2.2%) 800 (+1.9%) 2020-05-11 ​ ​ ​ 16,326 (+2.1%) 811 (+1.4%) 2020-05-12 ​ ​ ​ 16,882 (+3.4%) 838 (+3.4%) 2020-05-13 ​ ​ ​ 17,204 (+1.9%) 861 (+2.7%) 2020-05-14 ​ ​ ​ 17,615 (+2.4%) 883 (+2.5%) 2020-05-15 ​ ​ ​ 18,016 (+2.3%) 907 (+2.7%) 2020-05-16 ​ ​ ​ 18,257 (+1.3%) 915 (+0.8%) 2020-05-17 ​ ​ ​ 18,529 (+1.5%) 925 (+1.1%) 2020-05-18 ​ ​ ​ 18,885 (+1.9%) 936 (+1.2%) 2020-05-19 ​ ​ ​ 19,267 (+2.0%) 948 (+1.3%) 2020-05-20 ​ ​ ​ 19,738 (+2.4%) 962 (+1.5%) 2020-05-21 ​ ​ ​ 20,141 (+2.0%) 972 (+1.0%) 2020-05-22 ​ ​ ​ 20,613 (+2.4%) 982 (+1.0%) 2020-05-23 ​ ​ ​ 20,929 (+1.5%) 993 (+1.1%) 2020-05-24 ​ ​ ​ 21,290 (+1.7%) 996 (+0.3%) 2020-05-25 ​ ​ ​ 21,631 (+1.6%) 1007 (+1.1%) 2020-05-26 ​ ​ ​ 22,074 (+2.0%) 1024 (+1.7%) 2020-05-27 ​ ​ ​ 22,470 (+1.8%) 1028 (+0.4%) 2020-05-28 ​ ​ ​ 22,822 (+1.6%) 1038 (+1.0%) 2020-05-29 ​ ​ ​ 23,155 (+1.5%) 1051 (+1.2%) 2020-05-30 ​ ​ ​ 23,567 (+1.8%) 1061 (+0.95%) 2020-05-31 ​ ​ ​ 23,786 (+0.9%) 1064 (+0.3%) 2020-06-01 ​ ​ ​ 24,159 (+1.6%) 1074 (+0.9%) 2020-06-02 ​ ​ ​ 24,395 (+1.0%) 1092 (+1.7%) 2020-06-03 ​ ​ ​ 24,687 (+1.2%) 1115 (+2.1%) 2020-06-04 ​ ​ ​ 25,048 (+1.5%) 1117 (+0.2%) 2020-06-05 ​ ​ ​ 25,410 (+1.4%) 1137 (+1.8%) 2020-06-06 ​ ​ ​ 25,986 (+2.3%) 1151 (+1.4%) 2020-06-07 ​ ​ ​ 26,561 (+2.2%) 1155 (+0.3%) 2020-06-08 ​ ​ ​ 27,160 (+2.2%) 1164 (+0.8%) 2020-06-09 ​ ​ ​ 27,560 (+1.5%) 1183 (+1.6%) 2020-06-10 ​ ​ ​ 27,842 (+1.0%) 1206 (+1.9%) 2020-06-11 ​ ​ ​ 28,201 (+1.3%) 1215 (+0.7%) 2020-06-12 ​ ​ ​ 28,577 (+1.3%) 1222 (+0.6%) 2020-06-13 ​ ​ ​ 29,017 (+1.5%) 1237 (+1.2%) 2020-06-14 ​ ​ ​ 29,392 (+1.3%) 1247 (+0.8%) 2020-06-15 ​ ​ ​ 29,788 (+1.3%) 1256 (+0.7%) 2020-06-16 ​ ​ ​ 30,195 (+1.4%) 1272 (+1.3%) 2020-06-17 ​ ​ ​ 30,645 (+1.5%) 1286 (+1.1%) 2020-06-18 ​ ​ ​ 30,959 (+1.0%) 1316 (+2.3%) 2020-06-19 ​ ​ ​ 31,311 (+1.1%) 1334 (+1.4%) 2020-06-20 ​ ​ ​ 31,620 (+1.0%) 1346 (+0.9%) 2020-06-21 ​ ​ ​ 31,931 (+1.0%) 1356 (+0.7%) 2020-06-22 ​ ​ ​ 32,227 (+0.9%) 1359 (+0.2%) 2020-06-23 ​ ​ ​ 32,527 (+0.9%) 1375 (+1.2%) 2020-06-24 ​ ​ ​ 32,821 (+0.9%) 1396 (+1.5%) 2020-06-25 ​ ​ ​ 33,119 (+0.9%) 1412 (+1.5%) 2020-06-26 ​ ​ ​ 33,395 (+0.8%) 1429 (+1.2%) 2020-06-27 ​ ​ ​ 33,714 (+1.0%) 1435 (+0.4%) 2020-06-28 ​ ​ ​ 33,907 (+0.6%) 1438 (+0.2%) 2020-06-29 ​ ​ ​ 34,154 (+0.7%) 1444 (+0.4%) 2020-06-30 ​ ​ ​ 34,393 (+0.7%) 1463 (+1.3%) 2020-07-01 ​ ​ ​ 34,775 (+1.1%) 1477 (+1.0%) 2020-07-02 ​ ​ ​ 35,146 (+1.1%) 1492 (+1.0%) Sources: Polish Ministry of Health via official press conferences, official tweets and website; see the tables for detailed references.





Pre-4 March 2020 [ edit ]

On 19 February, twelve people remained hospitalised ""in connection with the coronavirus"", 13 were under home quarantine and 1000 were being monitored by health services.[41] On 27 February 47 people remained hospitalised with suspicions of SARS-CoV-2 infection, 55 were under home quarantine and 1570 were being monitored by health services.[12] Polish Minister of Health Łukasz Szumowski stated on 27 February that he expected positive SARS-CoV-2 laboratory confirmed cases in the following days.[12]

On 3 March, a total of 559 SARS-CoV-2 tests had been run for people in Poland suspected of SARS-CoV-2 infection, all with negative results,[42] while the numbers of people home quarantined and monitored increased and the number of hospitalised, suspected cases dropped.[43]

4–9 March: imported cases only [ edit ]

SARS-CoV-2 cases and COVID-19 deaths in Poland Daily lab-confirmed SARS-CoV-2 cases and U07.1 COVID-19 deaths in Poland. The value of 0 per day is displayed as 1 per day.

Timeline of major events of COVID-19 pandemic in Poland 4 March 2020 First confirmed case 12 March First confirmed death 12 March Lockdown-type controls: schools and university are closed (extended several times) 15 March Sanitary cordon on all Polish borders 20 March Government officially declared a state of epidemic[44] 21 March 500 confirmed cases 6 April 100 confirmed deaths 8 April 5,000 confirmed cases 22 April 10,000 confirmed cases 25 April 500 confirmed deaths 8 May 5,000 confirmed recoveries 21 May 20,000 confirmed cases 25 May 1,000 confirmed deaths 26 May 10,000 confirmed recoveries

The first lab-confirmed case of SARS-CoV-2 in Poland was announced on 4 March 2020, out of 584 tests in total.[3] The patient, a 66-year-old man, returned from a visit to Westphalia in Germany by bus to Świecko and from there by private car to Cybinka. He telephoned a general practitioner. He was taken by ambulance to a hospital in Zielona Góra, where he arrived around midday 2 March. In the evening of 2 March, a sample from the patient was sent for analysis to Warsaw. The result was known to be positive during the night of 3 to 4 March, and announced by the Minister of Health at 8:00 local time on 4 March. OKO.press criticised the delay of 44 hours from the patient's arrival at the hospital to the announcement of the positive test result as excessive.[35] Close contacts of the patient were home quarantined. The Minister of Health requested the media to respect the patient's privacy.[3]

On 6 March, Polish Minister of Health Łukasz Szumowski announced the confirmation of four new cases:[45] one hospitalised in Ostróda, linked to ""patient zero"" from Cybinka (the two had travelled in the same bus); two patients in Szczecin who had returned by car from Italy; and one patient in Wrocław who had returned from the United Kingdom (UK).[36] On 7 March, another SARS-CoV-2 case, of another person who had travelled in the bus together with ""patient-zero"", was announced by the Minister of Health as lab-confirmed.[46]

On 8 March, The Ministry of Health reported two new cases of SARS-CoV-2 infection. One person was hospitalised in Warsaw and another in Racibórz (Silesian Voivodeship). Both were in good condition.[47] In the evening, the Ministry confirmed another three positive test results, increasing the daily case count to five new cases. The patients were hospitalised in Warsaw, Wrocław and Racibórz: one elderly person, one middle-aged and one young.[48][49] The elderly person (hospitalised in Wrocław) was in serious condition.[50]

On 9 March, in the morning, Polish Minister of Health Łukasz Szumowski announced the confirmation of five new cases. Three cases were confirmed in Racibórz, one in Kraków, one in Wrocław and one in Poznań, bringing the total number of confirmed SARS-CoV-2 cases in Poland to 17.[51]

10 March–27 March: local transmission [ edit ]

On 10 March, the mode of SARS-CoV-2 transmission in Poland was officially declared to the World Health Organization as having shifted from imported cases only to local transmission.[13][14]

The eighteenth confirmed SARS-CoV-2 infection was announced in the Masovian Voivodeship on 10 March. The two SARS-CoV-2 patients earlier announced in Warsaw were both seriously ill with COVID-19.[52] Armed Forces General Commander gen. Jarosław Mika was diagnosed with the virus on 10 March.[53]

On 16 March, the number of confirmed cases increased to 177 and the death toll to 4. One of those infected was Minister of the Environment Michał Woś [pl].[54]

On 17 March, ""patient zero"", at Zielona Góra hospital, tested negative for SARS-CoV-2 the second time, and was considered to have recovered.[55][56]

28 March–1 April: nursing home and hospital clusters [ edit ]

On 17 March, a doctor at a hospital in Grójec, ""Z."", had a dry cough and fever and had a sample taken for SARS-CoV-2 testing. While several members of staff did not want to work with him, the head of their group disagreed but decided after a long debate to isolate Z. The hospital continued to function for the rest of the day without disinfection of the places where Z. had been present. On 18 March Z. was confirmed to be SARS-CoV-2 positive, and the hospital took samples from close contacts of Z. from the previous five days. Some of the nurses were ordered back to work at the hospital while waiting for their test results. As of 24 March, 11 of the 59 patients of the hospital and seven medical personnel were found to be SARS-CoV-2 positive. Onet.pl and Gazeta Wyborcza described the situation as contagion by carelessness.[57]

One of the Grójec hospital personnel also worked at a Niedabyl nursing home. On 28 March, 52 of the 66 residents and eight employees were found to be SARS-CoV-2 positive.[58]

On 1 April, 38 hospitals and hospital sections around Poland, including twelve in the Masovian Voivodeship that includes the Polish capital of Warsaw, were temporarily closed due to the risk of SARS-CoV-2 contamination from a confirmed or likely SARS-CoV-2 infected patient.[59]

Epidemic controls [ edit ]

Lockdown type measures [ edit ]

Polish authorities' initial COVID-19 limitation strategy of laboratory testing, contact tracing, quarantining and monitoring intensified in mid-March with ""lockdown"" type measures. On 10 March, authorities cancelled all mass events, defined as those allowing 1000 or more participants in the case of stadiums or other events outside of buildings, and those allowing 500 or more participants in the case of events in buildings.[17] Cultural institutions, such as philharmonic orchestras, operas, theatres, museums, and cinemas, had their activities suspended beginning on 12 March 2020.[18]

All schools in Poland were closed starting on 12 March, with a reopening initially scheduled for 25 March 2020.[19] The closure was extended to 10 April, with schools being required to carry out online classes with their students. As of 20 March, the dates of final exams for eighth (final) year of primary school and matura, the exam during the final year of secondary school (liceum or technikum), remained unchanged.[60]

Universities cancelled classes for the same period, while typically keeping research and administrative staff at work and allowing exceptions for research purposes.[61]

An official epidemic was declared in Poland on 20 March 2020 by the prime minister, Mateusz Morawiecki.[44]

On 24 March, Poland's government announced further restrictions on people leaving their homes and on public gatherings to further limit the spread of SARS-CoV-2 infections. The new limits constrained gatherings by default to a maximum of two people (with an exception for families); an exception for religious gatherings, such as mass in the Catholic Church, funerals and marriages in which five participants and the person conducting the ceremony were allowed to gather; and an exception for work places. Non-essential travel was prohibited, with the exception of travelling to work or home, SARS-CoV-2 control related activities, or ""necessary everyday activities"". Everyday activities qualifying as ""necessary"" included shopping, buying medicines, visiting doctors, walking dogs, jogging, cycling and walking, provided that no more than two people participate and contact with others was avoided. The restrictions were initially defined for the period from 25 March to 11 April inclusive.[20][62]

As of 12 March 2020, the National Bank of Poland, to which commercial banks in Poland send their bank notes to, carried out a two-week quarantine procedure and heating at 150 °C (302 °F) for all bank notes, prior to returning the notes for circulation.[63][64]

On 31 March, the prime minister announced that Poland would strengthen the restrictions starting from 31 March–1 April. Lawyers contacted by OKO.press expected the restrictions to be issued as a regulation (secondary legislation) (Polish: rozporządzenie), which they considered would be an unconstitutional method of introducing the rules.[65] The regulation was published in Dziennik Ustaw on 31 March 2020 as a regulation issued by the government.[25] According to the regulation, minors (aged under 18) were prohibited from leaving their homes unaccompanied by a legal guardian. Parks, boulevards and beaches were closed, as well as all hairdressers, beauty parlours and tattoo and piercing salons. Hotels were allowed to operate only if they had residents in quarantine, in another form of isolation, on an obligatory work delegation for services such as building construction or medical purposes. Individuals walking in public were obliged to be separated by at least two metres, with the exception of guardians of children under 13 and disabled persons. No restrictions were applied to people travelling in private cars.[66][65]

The 31 March regulation allowed religious (Article 9.3a) and other (Article 15.1, 15.2) gatherings of only five people plus a religious personnel or funeral employees from 1 to 11 April. The gatherings were allowed to be bigger, up to 50 people, inclusive of religious personnel, to start from 12 April 2020 until further notice.[25] An updated regulation on 10 April retained the authorisation of religious/funeral gatherings of up to 50 people but shifted the start date to 20 April (Article 9.2) while other gatherings remained banned (Article 14)[26][67] 1 person per 10 m2.[68][69]

On 9 April, Mateusz Morawiecki announced that the closure of educational institutions and international transport would continue to 26 April, the borders would remain ""closed"" until 3 May, and people entering Poland would still be required to be quarantined for 14 days. Szumowski stated that the closure of cultural institutions and limits implemented in shops would continue to 19 April. A new control measure was planned to start from 16 April, making it obligatory to cover one's nose and mouth in public places.[70] After being asked where people could obtain masks from, Szumowski clarified that any form of face covering, such as scarves, would be acceptable.[71] A government website differed from the 31 March regulation, stating that religious gatherings were to be limited to at most five people until 19 April.[72] Police stated that the 10 April gathering of the de facto leader of Poland Jarosław Kaczyński[73] and nine other people, standing close together, commemorating the Smolensk air disaster by laying a wreath, did not constitute a gathering in the sense of big gatherings forbidden in relation to the COVID-19 pandemic. Former prime minister of Poland Leszek Miller described the gathering as showing contempt for ordinary people respecting the COVID-19 restrictions.[74]

SARS-CoV-2 tests [ edit ]

