query_id,query,result position,url,article_text1,article_text2
mining is derived from one of the world's largest bituminous coalfields of the Upper Silesian Industrial District ( Górnośląski Okręg Przemysłowy ) and the Rybnik Coal District ( Rybnicki Okręg Węglowy ) with its major cities Rybnik , Jastrzębie Zdrój , Żory and Wodzisław Śląski . Lead and zinc can be found near Bytom , Zawiercie and Tarnowskie Góry ; iron ore and raw materials for building – near Częstochowa . The most important regional industries are: mining, iron, lead and zinc metallurgy, power industry, engineering, automobile, chemical, building materials and textile. In the past, the Silesian economy was determined by coal mining. Now, considering the investment volume, car manufacturing is becoming more and more important. The most profitable company in the region is Fiat Auto-Poland S.A. in Bielsko-Biała with a revenue of PLN 6.2 billion in 1997. Recently a new car factory has been opened by GM  Opel in Gliwice. There are two Special Economic Zones in the area: Katowice and Częstochowa. The voivodship's economy consists of about 323,000, mostly small and medium-sized, enterprises employing over 3 million people. The biggest Polish steel-works ""Huta Katowice"" is situated in Dąbrowa Górnicza . The unemployment rate stood at 3.9% in 2017 and was lower than the national average. [9]     Year  2006  2007  2008  2009  2010  2011  2012  2013  2014  2015  2016  2017   Unemployment rate (in %)  14.2  8.1  6.6  6.7  9.2  9.2  9.4  9.7  8.6  7.2  5.4  3.9  Transport [ edit ]   Terminal A at Katowice International Airport  Katowice International Airport (in Tarnowskie Góry County ) is used for domestic and international flights, Other Nearby Airports are John Paul II International Airport Kraków-Balice and Warsaw Frédéric Chopin Airport . The Silesian agglomeration railway network has the largest concentration in the country. The voivodship capital enjoys good railway and road connections with Gdańsk ( motorway A1 ) and Ostrava (motorway A1), Kraków ( motorway A4 ), Wrocław (motorway A4), Łódź (motorway A1) and Warsaw . It is also the crossing point for many international routes like E40 connecting Calais , Brussels , Cologne , Dresden , Wrocław , Kraków and Kiev and E75 from Scandinavia to the Balkans . A relatively short distance to Vienna facilitates cross-border co-operation and may positively influence the process of European integration. Linia Hutnicza Szerokotorowa (known by its acronym LHS , English: Broad gauge metallurgy line ) in Sławków is the longest broad gauge  railway line in Poland. The line runs on a single track for almost 400 km from the Polish- Ukrainian border, crossing it just east of Hrubieszów . It is the westernmost broad gauge railway line in Europe that is connected to the broad gauge rail system of the countries of the former Soviet Union.  Education [ edit ]  There are eleven public universities in the voivodship. The biggest university is the University of Silesia in Katowice , with 43,000 students. The region's capital boasts the Medical University , The Karol Adamiecki University of Economics in Katowice , the University of Music in Katowice , the Physical Education Academy and the Academy of Fine Arts. Częstochowa is the seat of the Częstochowa University of Technology and Pedagogic University. The Silesian University of Technology in Gliwice is nationally renowned. Bielsko-Biała is home of the Technical-Humanistic Academy. In addition, 17 new private schools have been established in the region. There are over 300,000 people currently studying in the Voivodeship.  Politics [ edit ]   Silesian Regional Assembly  Main article: Silesian Regional Assembly  The Silesian voivodeship's government is headed by the province's voivode (governor) who is appointed by the Polish Prime Minister . The voivode is then assisted in performing his duties by the voivodeship's marshal, who is the appointed speaker for the voivodeship's executive and is elected by the sejmik (provincial assembly). The current voivode of Silesia is Jarosław Wieczorek, whilst the present marshal is Wojciech Saługa. The Sejmik of Silesia consists of 48 members.  2018 election [ edit ]      Political groups [10]   Mandates     Prawo i Sprawiedliwość   22     Koalicja Obywatelska   20     SLD Lewica Razem   2     Polskie Stronnictwo Ludowe   1     Total  45  Administrative division [ edit ]  Silesian Voivodeship is divided into 36 counties ( powiats ). These include 19 city counties (far more than any other voivodeship) and 17 land counties. The counties are further divided into 167 gminas . The counties are listed in the following table (ordering within categories is by decreasing population).    English and Polish names   Area  (km²)   Population  (2019)   Seat   Other towns   Total  gminas    City counties    Katowice   165  293,636    1   Częstochowa   160  221,252    1   Sosnowiec   91  201,121    1   Gliwice   134  179,154    1   Zabrze   80  172,806    1   Bielsko-Biała   125  170,953    1   Bytom   69  165,975    1   Rybnik   148  138,319    1   Ruda Śląska   78  137,624    1   Tychy   82  127,664    1   Dąbrowa Górnicza   188  119,800    1   Chorzów   33  107,963    1   Jaworzno   152  91,263    1   Jastrzębie-Zdrój   85  88,808    1   Mysłowice   66  74,515    1   Siemianowice Śląskie   25  66,963    1   Żory   65  62,462    1   Piekary Śląskie   40  55,088    1   Świętochłowice   13  49,762    1   Land counties    Cieszyn County powiat cieszyński  730  178,145  Cieszyn   Ustroń , Skoczów , Wisła , Strumień   12   Bielsko County powiat bielski  457  165,374  Bielsko-Biała *  Czechowice-Dziedzice , Szczyrk , Wilamowice   10   Wodzisław County powiat wodzisławski  287  157,346  Wodzisław Śląski   Rydułtowy , Radlin , Pszów   9   Żywiec County powiat żywiecki  1,040  152,877  Żywiec     15   Będzin County powiat będziński  368  148,516  Będzin   Czeladź , Wojkowice , Sławków , Siewierz   8   Tarnowskie Góry County powiat tarnogórski  643  140,022  Tarnowskie Góry   Radzionków , Kalety , Miasteczko Śląskie   9   Częstochowa County powiat częstochowski  1,519  134,637  Częstochowa *  Blachownia , Koniecpol   16   Zawiercie County powiat zawierciański  1,003  118,020  Zawiercie   Poręba , Łazy , Ogrodzieniec , Szczekociny , Pilica   10   Gliwice County powiat gliwicki  663  115,571  Gliwice *  Knurów , Pyskowice , Toszek , Sośnicowice   8   Pszczyna County powiat pszczyński  473  111,324  Pszczyna     6   Racibórz County powiat raciborski  544  108,388  Racibórz   Kuźnia Raciborska , Krzanowice   8   Mikołów County powiat mikołowski  232  98,689  Mikołów   Łaziska Górne , Orzesze   5   Kłobuck County powiat kłobucki  889  84,762  Kłobuck   Krzepice   9   Rybnik County powiat rybnicki  225  78,148  Rybnik *  Czerwionka-Leszczyny   5   Lubliniec County powiat lubliniecki  822  76,470  Lubliniec   Woźniki   8   Myszków County powiat myszkowski  479  70,959  Myszków   Żarki , Koziegłowy   5   Bieruń-Lędziny County powiat bieruńsko-lędziński  157  59,715  Bieruń   Lędziny , Imielin   5   * seat not part of the county   Protected areas [ edit ]   Little Beskids Landscape Park  Protected areas in Silesian Voivodeship include eight areas designated as Landscape Parks :  Eagle Nests Landscape Park (partly in Lesser Poland Voivodeship )  Little Beskids Landscape Park (partly in Lesser Poland Voivodeship)  Rudy Landscape Park  Silesian Beskids Landscape Park  Stawki Landscape Park  Upper Liswarta Forests Landscape Park  Załęcze Landscape Park (partly in Łódź Voivodeship )  Żywiec Landscape Park  See also [ edit ]  History of Silesia  Silesian Uprisings  References [ edit ]    ^ a  b  ""Population. Size and structure and vital statistics in Poland by territorial divison in 2019. As of 30th June"" . stat.gov.pl . Statistics Poland. 2019-10-15 . Retrieved 2020-02-14 .   ^  ""Sub-national HDI - Area Database - Global Data Lab"" . hdi.globaldatalab.org . Retrieved 2020-03-22 .   ^  Arkadiusz Belczyk, Tłumaczenie polskich nazw geograficznych na język angielski  Archived 2016-03-03 at the Wayback Machine [Translation of Polish Geographical Names into English], 2002–2006.   ^  ""Archived copy"" . Archived from the original on 2017-08-16 . Retrieved 2017-07-24 . CS1 maint: archived copy as title ( link )   ^ a  b  Śląskiego, Urząd Marszałkowski Województwa. ""Województwo Śląskie - Śląskie. Pozytywna energia""  (PDF) . www.silesia-europa.pl . Retrieved 15 March 2018 .   ^  ""Śląski Urząd Wojewódzki w Katowicach - strona oficjalna"" . Archived from the original on 19 October 2009 . Retrieved 12 December 2016 .   ^  Art4net. ""The Śląskie Voivodeship"" . Archived from the original on 30 June 2016 . Retrieved 12 December 2016 .   ^  ""Regional GDP per capita ranged from 30% to 263% of the EU average in 2018"" . Eurostat .   ^  ""Regional Unemployment by NUTS2 Region"" . Eurostat .   ^  Serwis PKW – Wybory 2018    External links [ edit ]  The Website of Silesia  Województwo Śląskie Official website  v t e Counties of Silesian Voivodeship City counties  Katowice (capital)  Bielsko-Biała  Bytom  Chorzów  Częstochowa  Dąbrowa Górnicza  Gliwice  Jastrzębie-Zdrój  Jaworzno  Mysłowice  Piekary Śląskie  Ruda Śląska  Rybnik  Siemianowice Śląskie  Sosnowiec  Świętochłowice  Tychy  Zabrze  Żory  Land counties  Będzin  Bielsko  Bieruń-Lędziny  Cieszyn  Częstochowa  Gliwice  Kłobuck  Lubliniec  Mikołów  Myszków  Pszczyna  Racibórz  Rybnik  Tarnowskie Góry  Wodzisław  Zawiercie  Żywiec   v t e Voivodeships of Poland  Greater Poland  Kuyavian-Pomeranian  Lesser Poland  Łódź  Lower Silesian  Lublin  Lubusz  Masovian  Opole  Podkarpackie  Podlaskie  Pomeranian  Silesian  Świętokrzyskie  Warmian-Masurian  West Pomeranian   v t e Silesia topics History  Offensives  Uprisings  Wars ( First , Second , Third )  Upper Silesia plebiscite  Treaty of Dresden  Treaty of Teschen  Book of Henryków  Battle of Legnica  Battle of Leuthen  more...  Geography Areas  Jelenia Góra valley  Kłodzko Valley  Lower Silesian Wilderness  Obniżenie Milicko-Głogowskie  Ostrava Valley  Oświęcim Basin  Przedgórze Sudeckie  Silesian Walls  Silesian Foothills  Silesian Lowlands  Silesian Przesieka  Silesian Upland  Silesian-Lusatian Lowlands  Silesian-Moravian Foothills  Wał Trzebnicki  Zielona Góra Acclivity  Lakes  Jezioro Goczałkowickie  Jezioro Otmuchowskie  Jezioro Sławskie  Nyskie  Slezská Harta Dam  Mountains  Carpathian  Silesian Beskids  Moravian-Silesian Beskids  Sudetes  Eastern  Central  Western  Rivers Elbe  Divoká Orlice  Jizera  Úpa  Oder  Barycz  Bóbr  Kaczawa  Kłodnica  Kwisa  Liswarta  Mała Panew  Nysa Kłodzka  Olza  Ślęza  Vistula  Biała  Brynica  Gostynia  Przemsza  Pszczynka  Rawa  Politics Subdivisions Former  Duchies  Piasts  dukes  Silesian Voivodeship (1920–39)  parliament  politicians  treasury  State country  Silesia Province  Upper Silesia  Lower Silesia  Sudetenland  New Silesia  Austrian Silesia  Eastern Silesia  Current  Jeseník District  Moravian–Silesian Region  Niederschlesischer Oberlausitzkreis / Görlitz  Voivodeships  Lower Silesian  Lubusz Voivodeships  Opole  Silesian  EP  constituencies  Lower Silesian and Opole  Silesian  Economy  Bielski Okręg Przemysłowy  Katowice urban area  Legnicko-Głogowski Okręg Miedziowy  Lower Silesian Coal Basin  Upper Silesian Coal Basin  Industrial Region  Ostrava-Karviná / Rybnik Coal Areas  Upper Silesian metropolitan area  Tourism  Society Culture  Architecture  Familŏk  Regional costume  Upper Silesian Museum  Silesian Museum (Opava)  Silesian Museum (Katowice)  Cuisine  Black noodles  Bryja  Panczkraut (ciapkapusta)  Klōzki  Galert  Hauskyjza  Karminadle  Kołŏcz  Kreple  Krupniok  Makōwki  Moczka  Modrŏ kapusta  Siymiyniotka  Szałŏt  Wodziōnka  Żur  Religion  Evangelical Church in Berlin, Brandenburg and Silesian Upper Lusatia  Silesian Evangelical Church of the Augsburg Confession  Evangelical Church of the Augsburg Confession in Poland  Roman Catholic Church  Pentecostal Church in Poland  Sport  Football Association  Moravian–Silesian Football League  National football team  Silesian Stadium  Languages Silesian  Bytom  Cieszyn  Jabłonków  Lach  Lower  Namysłów  Niemodlin  Opole  Prudnik  Sulkovian  Syców  Texas   Czech  German  Silesian German (Lower Silesian)  Moravian  Polish  Symbols  Coats of arms  Flags  Unofficial anthems  Schlesien Unvergessene Heimat  Schlesierlied  Slezská hymna  Other topics  Demographics  Landsmannschaft Schlesien  Silesian Autonomy Movement  Silesians    Category   Coordinates : 50°20′00″N  19°00′01″E ﻿ / ﻿ 50.33333°N 19.00028°E ﻿ / 50.33333; 19.00028   Authority control   GND : 4386280-9  LCCN : n2001105289  MusicBrainz : 34cee74b-bb90-4f7d-82c1-63ec20007145  NKC : ge116537  VIAF : 137152383   WorldCat Identities : lccn-n82119105       Retrieved from "" https://en.wikipedia.org/w/index.php?title=Silesian_Voivodeship&oldid=961913695 ""  Categories : Silesian Voivodeship Hidden categories: Webarchive template wayback links CS1 maint: archived copy as title Articles with short description Articles containing Polish-language text Articles containing German-language text Articles containing Czech-language text Coordinates on Wikidata Wikipedia articles with GND identifiers Wikipedia articles with LCCN identifiers Wikipedia articles with MusicBrainz area identifiers Wikipedia articles with NKC identifiers Wikipedia articles with VIAF identifiers Wikipedia articles with WorldCat identifiers         Navigation menu      Personal tools      Not logged in Talk Contributions Create account Log in        Namespaces      Article Talk        Variants              Views      Read Edit View history        More           Search                     Navigation      Main page Contents Current events Random article About Wikipedia Contact us Donate Wikipedia store       Contribute      Help Community portal Recent changes Upload file       Tools      What links here Related changes Upload file Special pages Permanent link Page information Wikidata item Cite this page       In other projects      Wikimedia Commons Wikivoyage       Print/export      Download as PDF Printable version       Languages      Ænglisc العربية Asturianu تۆرکجه Bân-lâm-gú Беларуская Беларуская (тарашкевіца)‎ Български Bosanski Català Cebuano Čeština Dansk Deutsch Dolnoserbski Eesti Эрзянь Español Esperanto Euskara فارسی Français Gaelg Galego 客家語/Hak-kâ-ngî 한국어 Hornjoserbsce Hrvatski Bahasa Indonesia Ирон Íslenska Italiano עברית Jawa ქართული Kaszëbsczi Latina Latviešu Lietuvių Limburgs Lumbaart Magyar Македонски मराठी Bahasa Melayu Мокшень Nederlands 日本語 Norsk bokmål Norsk nynorsk Occitan پنجابی Papiamentu پښتو Polski Português Qırımtatarca Română Runa Simi Русский Simple English Slovenčina Slovenščina Ślůnski Српски / srpski Suomi Svenska ไทย Türkçe Удмурт Українська اردو Tiếng Việt Winaray 吴语 粵語 Zazaki Zeêuws 中文  Edit links        This page was last edited on 11 June 2020, at 02:33 (UTC) .  Text is available under the Creative Commons Attribution-ShareAlike License ;
additional terms may apply.  By using this site, you agree to the Terms of Use and Privacy Policy . Wikipedia® is a registered trademark of the Wikimedia Foundation, Inc. , a non-profit organization.    Privacy policy  About Wikipedia  Disclaimers  Contact Wikipedia  Developers  Statistics  Cookie statement  Mobile view          "
1,1 (coronavirus | covid | pandemic),3,https://en.wikipedia.org/wiki/Ukrainians_in_Poland,"The Ukrainian minority in Poland (Ukrainian: Українці, Ukrayintsi, Polish: Ukraińcy) was composed of approximately 51,000 people (including 11,451 without Polish citizenship[2]), according to the Polish census of 2011. Some 38,000 respondents named Ukrainian as their first identity (28,000 as their sole identity), 13,000 as their second identity, and 21,000 declared Ukrainian identity jointly with Polish nationality.[3]

On 14 September 2018, 33,624 Ukrainian citizens possessed a permanent residence permit, and 132,099 had a temporary residence permit.[4] About 1 to 2 million Ukrainian citizens are working in Poland.[5][6] There are also 40,000 Ukrainian students in Poland.[6]

In the years between 2005 and 2006 the Ukrainian language was taught at 162 schools attended by 2,740 Ukrainian students.[7]

Cultural life [ edit ]

Main Ukrainian organizations in Poland include: Association of Ukrainians in Poland (Związek Ukraińców w Polsce), Association of Ukrainians of Podlasie (Związek Ukraińców Podlasia), Ukrainian Society of Lublin (Towarzystwo Ukraińskie w Lublinie), Kyivan Rus Foundation of St. Volodymyt, pictured (Fundacja św. Włodzimierza Chrzciciela Rusi Kijowskiej), Association of Ukrainian Women (Związek Ukrainek), Ukrainian Educators' Society of Poland (Ukraińskie Towarzystwo Nauczycielskie w Polsce), Ukrainian Medical Society (Ukraińskie Towarzystwo Lekarskie), Ukrainian Club of Stalinist Political Prisoners (Stowarzyszenie Ukraińców - Więźniów Politycznych Okresu Stalinowskiego), Ukrainian Youth Association ""ПЛАСТ"" (Organizacja Młodzieży Ukraińskiej ""PŁAST""), Ukrainian Historical Society (Ukraińskie Towarzystwo Historyczne), and Association of Independent Ukrainian Youth (Związek Niezależnej Młodzieży Ukraińskiej). The most important periodicals published in Ukrainian language include: Our Voice (Nasze Słowo) weekly, and Над Бугом і Нарвою (Nad Buhom i Narwoju) bimonthly.[7]

The most important Ukrainian festivals and popular cultural events include: Festival of Ukrainian Culture in Sopot (""Festiwal Kultury Ukraińskiej"" w Sopocie), Youth Market in Gdańsk (""Młodzieżowy Jarmark"" w Gdańsku), Festival of Ukrainian Culture of Podlasie (Festiwal Kultury Ukraińskiej na Podlasiu ""Podlaska Jesień""), ""Bytowska Watra"", ""Spotkania Pogranicza"" in Głębock,[8] Days of Ukrainian Culture in Szczecin and Giżycko (""Dni Kultury Ukraińskiej""), Children Festival in Elbląg (Dziecięcy Festiwal Kultury w Elblągu), ""Na Iwana, na Kupała"" in Dubicze Cerkiewne, Festival of Ukrainian Children Groups in Koszalin (Festiwal Ukraińskich Zespołów Dziecięcych w Koszalinie), ""Noc na Iwana Kupała"" in Kruklanki, Ukrainian Folklor Market in Kętrzyn (Jarmark Folklorystyczny ""Z malowanej skrzyni""), Under the Common Skies in Olsztyn (""Pod wspólnym niebem""), and Days of Ukrainian Theatre (Dni teatru ukraińskiego) also in Olsztyn.[7]

History, and trends [ edit ]

Since World War II [ edit ]

After the quashing of a Ukrainian insurrection at the end of World War II by the Soviet Union, about 140,000 Ukrainians residing within the new Polish borders were forcibly moved to northern and western Poland during Operation Vistula, settling the former Recovered Territories ceded to Poland at the Tehran Conference of 1943.

The total of 27,172 people declared Ukrainian nationality in the Polish census of 2002. Most of them lived in the Warmian-Masurian Voivodeship (11,881), followed by West Pomeranian (3,703), Podkarpackie (2,984) and Pomeranian Voivodeship (2,831).[7] Some Lemkos (recognized in Poland as distinct ethnic group) regard themselves as members of the Ukrainian nation, while others distance themselves from Ukrainians.[7]

Economic migration [ edit ]

Ukrainian Settlement Permits and Temporary Residence Permits since Poland's EU accession [9] Permits / Year 2004 2005 2006 2007 2008 2009 Total Permanent Settlement Permits 1,905 1,654 1,438 1,609 1,685 1,280 9,571 Temporary Residence Permits 8,518 8,304 7,733 7,381 8,307 8,489 48,736 Grand total 58,303 Source: EU Membership Highlights Poland's Migration Challenges, Warsaw

Since 1989, following the collapse of the Soviet Union, there has been a new wave of Ukrainian immigration, mostly of job seekers, tradesmen, and vendors, concentrated in larger cities with established market. After the Poland's 2004 accession to the European Union, in order to meet the requirements of the Schengen zone (an area of free movement within the EU), the government was forced to make immigration to Poland more difficult for the people from Belarus, Russia or Ukraine. Nevertheless, Ukrainians consistently receive the most settlement permits and the most temporary residence permits in Poland (see table).[9] As a result of the Eastern Partnership, Poland and Ukraine have reached a new agreement replacing visas with simplified permits for Ukrainians residing within 30 km of the border. Up to 1.5 million people would benefit from this agreement which took effect on July 1, 2009.[10] In 2017 the visa requirements were finally abolished for short stays of up to 90 days.[11]

After 2014, more Ukrainians from eastern Ukraine, more men, and more younger Ukrainians have been working in Poland.[12]

The overwhelming majority of applications for temporary residence are being accepted. Resulting from this, Ukrainians constituted 25% of the entire immigrant population of Poland in 2015.[13]

In January 2016 the Embassy of Ukraine in Warsaw informed that the number of Ukrainian residents in Poland was half a million, and probably around one million in total. Ukrainian Ambassador to Poland, Andrii Deshchytsia, noted that Ukrainian professionals enjoy good reputation in Poland and in spite of their growing numbers Polish-Ukrainian relations remain very good.[14]

According to the NBP, 1.2 million Ukrainian citizens worked legally in Poland in 2016.[15] 1.7 million short-term work registrations were issued to them in 2017 (an eightfold increase compared to 2013).[5] Ukrainian workers stay in Poland on average 3–4 months.[16]

The number of permanent residence permits increased from 5,375 in 2010 to 33,624 (14 September 2018), while the number of temporary residence permits increased from 7,415 to 132,099 over the same time period.[4]

About 102,000 Ukrainian citizens received Karta Polaka,[17] of whom some 15,500 obtained permanent residence permits in the period from 2014 to March 2018.[18]

Refugees [ edit ]

Following the 2014–15 Russian military intervention in Ukraine, including its illegal annexation and occupation of Crimea (""Helsinki Declaration""),[19] the situation changed dramatically. Poland began taking in large numbers of refugees from the Ukraine conflict as part of the EU's refugee programme.[20] The policy of strategic partnership between Kyiv and Warsaw was extended to military and technical cooperation,[21][22] but the more immediate task, informed Poland's State secretary Krzysztof Szczerski, was the Ukraine's constitutional reform leading to broad decentralization of power.[21] The number of applications for refugee status rose 50 times following the start of War in Donbass in Eastern Ukraine in 2014. However, most new applicants are not eligible to claim refugee protection in Poland, because Ukraine is a sovereign country with a democratic government fully accountable to its citizens. Resident visas in Poland are available in other immigration categories.[13]

See also [ edit ]

Notes [ edit ]

