1,it is more risky (coronavirus | covid | pandemic),2,https://www.cdc.gov/diabetes/managing/flu-sick-days.html,"These tips can help people with diabetes prepare for getting sick and take care of themselves if they do become ill.

Like everyone, people with diabetes can get sick even when trying their best to prevent it. So being prepared and knowing what to do if you get sick is very important. There are several things you can do now, but also talk to your doctor about the best way to handle being sick if it happens. Visit these pages for more information:

These tips can help you take care of yourself if you get sick.

Prepare Now Before Getting Sick

Make sure you have insulin, other diabetes medicines, and easy-to-fix foods in your home, enough for several weeks or longer:

Medicines and supplies

Milk of magnesia Medicine to control diarrhea Antacid Pain reliever Thermometer Suppositories to treat vomiting



Foods

Sports drinks Juice boxes Canned soup Regular gelatin Regular soft drinks Instant cooked cereals Crackers Instant pudding Unsweetened applesauce

If you can’t eat meals, you will need to eat or drink about 50 grams of carbohydrates every 4 hours, such as 1½ cup of unsweetened applesauce or 1½ cup of fruit juice.

If You Get Sick

If you do get sick, your blood sugar can be hard to manage. You may not be able to eat or drink as much as usual, which can affect blood sugar levels.

Your doctor may ask you to test your blood sugar more often when you’re sick. That’s because when your body releases hormones to fight the illness, those hormones can also raise your blood sugar levels and increase how much insulin you need. This is especially important for people with type 1 diabetes since they depend on insulin to live.

When your body doesn’t have enough insulin, it starts breaking down fat as fuel, which produces ketones. When too many ketones are produced too fast, they can cause diabetic ketoacidosisexternal icon, or DKA. DKA is very serious and can cause a coma or even death.

If you think you may have DKA, use an over-the-counter kit to test your urine for ketones. If ketones are present, call your doctor right away. You’ll probably need to go to the hospital for treatment.

Follow these additional steps when you’re sick even if your blood sugar is within your target range:

Continue taking your insulin and diabetes pills as usual .

. Test your blood sugar every 4 hours and keep track of the results.

Drink extra calorie-free liquids*, and try to eat as you normally would.

Weigh yourself every day. Losing weight without trying is a sign of high blood glucose.

Check your temperature every morning and evening. A fever may be a sign of infection.

*Drink plenty of fluids – 4 to 6 ounces every half-hour – to prevent dehydration. You may also need to drink beverages with sugar if you cannot get 50 grams of carbohydrates every 4 hours from other food choices. Drink small portions of these sweet beverages to keep your blood sugar from getting too high.","                           Skip directly to site content  Skip directly to page options  Skip directly to A-Z link         Centers for Disease Control and Prevention. CDC twenty four seven. Saving Lives, Protecting People               Centers for Disease Control and Prevention. CDC twenty four seven. Saving Lives, Protecting People               Search         ×   Submit       For a full list of topics: A-Z Index    Advanced Search     Advanced Search                     Diabetes              Section Navigation            CDC Home                        Facebook  Twitter  LinkedIn  Email  Syndicate                             Managing Sick Days Español (Spanish)           Related Pages      These tips can help people with diabetes prepare for getting sick and take care of themselves if they do become ill.  Like everyone, people with diabetes can get sick even when trying their best to prevent it. So being prepared and knowing what to do if you get sick is very important. There are several things you can do now , but also talk to your doctor about the best way to handle being sick if it happens. Visit these pages for more information:   People at High Risk for Severe COVID-19  Flu and People with Diabetes   These tips can help you take care of yourself if you get sick.   Prepare Now Before Getting Sick  Make sure you have insulin, other diabetes medicines, and easy-to-fix foods in your home, enough for several weeks or longer:   Medicines and supplies      Milk of magnesia  Medicine to control diarrhea  Antacid  Pain reliever  Thermometer  Suppositories to treat vomiting      Foods       Sports drinks  Juice boxes  Canned soup  Regular gelatin  Regular soft drinks  Instant cooked cereals  Crackers  Instant pudding  Unsweetened applesauce     If you can’t eat meals, you will need to eat or drink about 50 grams of carbohydrates every 4 hours, such as 1½ cup of unsweetened applesauce or 1½ cup of fruit juice.   If You Get Sick  If you do get sick, your blood sugar can be hard to manage. You may not be able to eat or drink as much as usual, which can affect blood sugar levels.  Your doctor may ask you to test your blood sugar more often when you’re sick. That’s because when your body releases hormones to fight the illness, those hormones can also raise your blood sugar levels and increase how much insulin you need. This is especially important for people with type 1 diabetes since they depend on insulin to live.  When your body doesn’t have enough insulin, it starts breaking down fat as fuel, which produces ketones. When too many ketones are produced too fast, they can cause diabetic ketoacidosis external icon , or DKA. DKA is very serious and can cause a coma or even death .  If you think you may have DKA, use an over-the-counter kit to test your urine for ketones. If ketones are present, call your doctor right away . You’ll probably need to go to the hospital for treatment.  Follow these additional steps when you’re sick even if your blood sugar is within your target range:   Continue taking your insulin and diabetes pills as usual .  Test your blood sugar every 4 hours and keep track of the results.  Drink extra calorie-free liquids*, and try to eat as you normally would.  Weigh yourself every day. Losing weight without trying is a sign of high blood glucose.  Check your temperature every morning and evening. A fever may be a sign of infection.   * Drink plenty of fluids – 4 to 6 ounces every half-hour – to prevent dehydration. You may also need to drink beverages with sugar if you cannot get 50 grams of carbohydrates every 4 hours from other food choices. Drink small portions of these sweet beverages to keep your blood sugar from getting too high.  Go to an emergency room if any of the following occurs:  You’re having trouble breathing.  You have moderate to high ketone levels in your urine.  You can’t keep any liquids down for more than 4 hours.  You lose 5 pounds or more during the illness.  Your blood sugar is lower than 60 mg/dl.  You feel too sick to eat normally and are unable to keep down food for more than 24 hours.  You have vomiting and/or severe diarrhea for more than 6 hours.  Your temperature is over 101 degrees F for 24 hours.  You feel sleepy or can’t think clearly. Have someone else call your doctor or take you to the emergency room.   Learn More  People at High Risk for Severe COVID-19    People at High Risk of Developing Serious Flu-Related Complications    Pneumococcal Vaccination    Influenza (Flu)   Top of Page           Page last reviewed: March 31, 2020  Content source: Centers for Disease Control and Prevention           home Diabetes Home     Diabetes Basics plus icon   What is Diabetes?   Diabetes Risk Factors plus icon   PCOS (Polycystic Ovary Syndrome) and Diabetes    Diabetes Symptoms  Prediabetes  Type 1 Diabetes   Type 2 Diabetes plus icon   Insulin Resistance and Diabetes    Gestational Diabetes  Diabetes Tests  Diabetes Fast Facts     Prevent Type 2 plus icon   Lost 170 Pounds and Regained His Life  On Your Way to Preventing Type 2 Diabetes  Prevent Type 2 Diabetes in Kids     Living with Diabetes plus icon   Education and Support   Eat Well plus icon   Diabetes Meal Planning  Grocery Shopping  Food Labels  Eating Out  Diabetes and Carbs  Diabetes & Kidney Disease: What to Eat?    Healthy Weight  Get Active!   Manage Blood Sugar plus icon   Monitoring Your Blood Sugar  All About Your A1C    Prevent Complications  Managing Sick Days  Your Diabetes Care Schedule  Be Prepared!  Diabetes & Mental Health     Data and Statistics plus icon   Frequently Asked Questions  National Diabetes Statistics Report  Diabetes Report Card  Diabetes and Obesity Maps     Resources and Publications plus icon    Reports and Publications plus icon   Research Articles and Publications    Fact Sheets   Infographics plus icon   Info Cards    Videos and Podcasts  Features and Spotlights  Social Media  Press  Glossary     Research plus icon    Applied Research and Surveillance plus icon   Rates of New Diagnosed Cases of Type 1 and Type 2 Diabetes Continue to Rise Among Children, Teens    Modeling and Economics  Health Policy and Health Services  Effectiveness Research  Global Projects  Publications    About Us   Awareness Campaigns plus icon   National Prediabetes Awareness Campaign  Your Health with Joan Lunden and CDC     Addressing Health Disparities in Diabetes plus icon   Appalachian            Social_govd     Get Email Updates    To receive updates about diabetes topics, enter your email address:     Email Address       What's this    Submit          DDT Websites Diabetes Home State, Local, and National Partner Diabetes Programs National Diabetes Prevention Program Native Diabetes Wellness Program Chronic Kidney Disease Vision Health Initiative  Related CDC Websites Heart Disease and Stroke Overweight & Obesity               HAVE QUESTIONS?     Visit CDC-INFO       Call 800-232-4636       Email CDC-INFO       Open 24/7      CDC INFORMATION   About CDC  Jobs  Funding  Policies  File Viewers & Players      Privacy  FOIA  No Fear Act  OIG  Nondiscrimination  Accessibility     CONNECT WITH CDC   Facebook  Twitter  Instagram  LinkedIn  Snapchat    Youtube  Syndicate  CDC TV  RSS  Email            U.S. Department of Health & Human Services      USA.gov      CDC Website Exit Disclaimer  external icon           Facebook    Twitter    LinkedIn    Email                                                                                                                                                                                                                                                                                                                                 Exit Notification/Disclaimer Policy   Close        Links with this icon indicate that you are leaving the CDC website.   The Centers for Disease Control and Prevention (CDC) cannot attest to the accuracy of a non-federal website.  Linking to a non-federal website does not constitute an endorsement by CDC or any of its employees of the sponsors or the information and products presented on the website.  You will be subject to the destination website's privacy policy when you follow the link.  CDC is not responsible for Section 508 compliance (accessibility) on other federal or private website.  For more information on CDC's web notification policies, see Website Disclaimers .    Cancel  Continue      "
